{
  "stage": "4-polish",
  "plugin": "O-simpleBeatmaker",
  "timestamp": "2026-06-26T05:27:39Z",
  "critics_run": [
    "foundation-critic",
    "architecture-critic",
    "dsp-critic",
    "ui-critic"
  ],
  "unified_issues": [
    {
      "severity": "warning",
      "critic": "foundation-critic",
      "id": "FND-001",
      "category": "cmake_correctness",
      "location": "tests/render-harness/CMakeLists.txt:50",
      "description": "The render-harness JucePlugin_ManufacturerCode stub is 0x4f756172 ('Ouar'), which matches neither the release manufacturer code OuAu nor the dev code OuDv. This is a hand-written stub for compiling PluginProcessor.cpp in the headless console app, which never registers an AU/VST3 component, so the value has zero functional impact and does not block the gate. Note the sibling JucePlugin_PluginCode stub IS correct (0x4f536942 = 'OSiB').",
      "fixSuggestion": "For consistency with the project standard, update the JucePlugin_ManufacturerCode macro in the harness CMake to the OuAu/OuDv code (0x4f754175 / 0x4f754476) so the test stub mirrors the real plugin; purely cosmetic, defer freely as it affects no built artifact."
    },
    {
      "severity": "warning",
      "critic": "ui-critic",
      "id": "UI-001",
      "category": "polish",
      "location": "Source/ui/public/index.html:108",
      "description": "The preset-tour subtitle uses the CSS class '.tour-soon' (defined styles.css:446), a stale name carried over from the pre-Stage-4 'coming soon' state. The visible copy is fully updated and the styling renders correctly, so this is a non-visible naming artifact only \u2014 no user-facing impact.",
      "fixSuggestion": "Rename the '.tour-soon' class to a state-neutral name such as '.tour-hint' in both index.html and styles.css to remove the stale 'coming soon' connotation; cosmetic cleanup, safe to defer."
    }
  ],
  "progression_allowed": true,
  "blocking_count": 0,
  "warning_count": 2,
  "note_count": 0
}
